id,URL,headline,Author,date
0,https://www.theverge.com/23658631/kitchen-cooking-coffee-gadgets-favorite-tech,The Verge’s 13 favorite kitchen tools,VERGE STAFF,2023/3/29
1,https://www.theverge.com/2023/3/29/23661826/disney-fired-isaac-perlmutter-marvel,Disney just laid off the guy it bought Marvel from... but that’s probably a good thing,EMMA ROTH,2023/3/30
2,https://www.theverge.com/2023/3/29/23661352/last-of-us-part-i-pc-launch-bugs-issues,The Last of Us on PC is a rare disappointing PlayStation port at launch,TOM WARREN,2023/3/29
3,https://www.theverge.com/2023/3/30/23656153/elon-musk-twitter-most-followed-barack-obama,Elon Musk is now the most-followed person on Twitter,EMMA ROTH,2023/3/30
4,https://www.theverge.com/2023/3/29/23662476/microsoft-bing-chatbot-ads-revenue-sharing,Microsoft’s Bing chatbot is getting ads,JAY PETERS,2023/3/30
5,https://www.theverge.com/23660625/gmail-inbox-unsubscribe-refresh-delete-reject,We need Eternal Sunshine of the Spotless Mind for Gmail,ALLISON JOHNSON,2023/3/29
